Ссылка,Название,Описание,Метро,Дальность от метро,Адрес,Стоимость,Стоимость за метр
https://www.cian.ru/sale/flat/310548633/,Комплекс на берегу двух рек!,"2-комн. апартаменты, 45,6 м², 13/25 этаж",Тушинская,5 минут на транспорте,"Москва, СЗАО, р-н Покровское-Стрешнево, м. Трикотажная, Волоколамское шоссе, 81/2с3",16 000 000 ₽,350 877 ₽/м²
https://www.cian.ru/sale/flat/311377502/,"2-комн. кв., 69 м², 13/17 этаж","2-комн. квартира, 69 м², 13/17 этаж",Филатов Луг,10 минут на транспорте,"Москва, НАО (Новомосковский), м. Аэропорт Внуково, Московский г., 3-й мкр, 6",15 990 000 ₽,231 739 ₽/м²
https://www.cian.ru/sale/flat/310716810/,"2-комн. квартира, 51 м², 9/10 этаж",Информация отсутствует,Лермонтовский проспект,4 минуты пешком,"Москва, ЮВАО, р-н Выхино-Жулебино, м. Лермонтовский проспект, Жулебинский бульвар, 14",15 999 999 ₽,313 725 ₽/м²
https://www.cian.ru/sale/flat/311318129/,Видовая 2к-квартира,"2-комн. квартира, 47 м², 7/14 этаж",Бульвар Рокоссовского,14 минут пешком,"Москва, ВАО, р-н Преображенское, м. Бульвар Рокоссовского, Халтуринская улица, 14К5",15 900 000 ₽,338 298 ₽/м²
https://www.cian.ru/sale/flat/310309718/,2-комнатная квартира,"2-комн. квартира, 52,9 м², 7/24 этаж",Солнцево,12 минут пешком,"Москва, ЗАО, р-н Солнцево, м. Солнцево, Производственная улица, 17",16 000 000 ₽,302 457 ₽/м²
https://www.cian.ru/sale/flat/311466281/,Тихая и уютная,"2-комн. квартира, 41 м², 1/5 этаж",Семёновская,8 минут пешком,"Москва, ВАО, р-н Соколиная гора, м. Семёновская, Зверинецкая улица, 6",16 000 000 ₽,390 244 ₽/м²
https://www.cian.ru/sale/flat/309295742/,Свежий современный ремонт!,"2-комн. квартира, 50 м², 5/14 этаж",Коптево,13 минут пешком,"Москва, САО, р-н Коптево, м. Коптево, Михалковская улица, 6",16 300 000 ₽,326 000 ₽/м²
https://www.cian.ru/sale/flat/297843913/,"2-комн. квартира, 65,4 м², 14/14 этаж",Секция 4 • Сдан,Кедровая,7 минут пешком,"Москва, НАО (Новомосковский), м. Кедровая, Десеновское поселение, улица 3-я Нововатутинская, 15к3",16 219 200 ₽,248 000 ₽/м²
https://www.cian.ru/sale/flat/306081919/,"2-комн. квартира, 51,1 м², 4/17 этаж",Информация отсутствует,Медведково,14 минут пешком,"Москва, СВАО, р-н Северное Медведково, м. Медведково, Широкая улица, 2к2",16 500 000 ₽,322 896 ₽/м²
https://www.cian.ru/sale/flat/308250039/,"2-комн. квартира, 52 м², 12/12 этаж",Информация отсутствует,Информация отсутствует,9 минут пешком,"Москва, СЗАО, р-н Хорошево-Мневники, м. Народное Ополчение, улица Демьяна Бедного, 19К2",16 500 000 ₽,317 308 ₽/м²
https://www.cian.ru/sale/flat/297402438/,"2-комн. квартира, 59,1 м², 3/5 этаж",Информация отсутствует,Стахановская,7 минут пешком,"Москва, ЮВАО, р-н Нижегородский, м. Стахановская, Орехово-Зуевский проезд, 18/8",16 400 000 ₽,277 496 ₽/м²
https://www.cian.ru/sale/flat/305335807/,"2-комн. квартира, 72,6 м², 4/17 этаж",Информация отсутствует,Информация отсутствует,Информация отсутствует,"Москва, ТАО (Троицкий), Троицк, площадь Академическая, 1",16 500 000 ₽,227 273 ₽/м²
https://www.cian.ru/sale/flat/310874054/,Панорамные виды на Москву!,"2-комн. квартира, 59,8 м², 15/32 этаж",Информация отсутствует,8 минут пешком,"Москва, ЮВАО, р-н Нижегородский, м. Нижегородская, Газгольдерная улица, 10",16 500 000 ₽,275 920 ₽/м²
https://www.cian.ru/sale/flat/309670577/,"Евродвушка в парке, суперремонт","2-комн. квартира, 46,1 м², 3/3 этаж",Сходненская,10 минут на транспорте,"Москва, СЗАО, р-н Куркино, м. Молжаниново, Родионовская улица, 16К4",16 500 000 ₽,357 918 ₽/м²
https://www.cian.ru/sale/flat/310636512/,Квартира с новым ремонтом,"2-комн. квартира, 53,6 м², 10/17 этаж",Братиславская,19 минут пешком,"Москва, ЮВАО, р-н Марьино, м. Люблино, улица Перерва, 68/35",16 699 999 ₽,311 567 ₽/м²
https://www.cian.ru/sale/flat/311191686/,"2-комн. квартира, 49,3 м², 8/14 этаж",Информация отсутствует,Водный стадион,5 минут на транспорте,"Москва, САО, р-н Головинский, м. Водный стадион, Кронштадтский бульвар, 43К3",16 800 000 ₽,340 771 ₽/м²
https://www.cian.ru/sale/flat/310972164/,Видовая квартира для тебя!,"2-комн. квартира, 54,1 м², 17/24 этаж",Новохохловская,3 минуты на транспорте,"Москва, ЮВАО, р-н Текстильщики, м. Текстильщики, 1-й Грайвороновский проезд, 3",16 731 000 ₽,309 261 ₽/м²
https://www.cian.ru/sale/flat/311330822/,Квартира возле Мещерского парка,"2-комн. квартира, 46,2 м², 6/25 этаж",Говорово,7 минут пешком,"Москва, ЗАО, р-н Солнцево, м. Говорово, Боровское шоссе, 2Ак1",16 800 000 ₽,363 636 ₽/м²
https://www.cian.ru/sale/flat/303626893/,"2-комн. квартира, 57,8 м², 2/24 этаж",Информация отсутствует,Бабушкинская,4 минуты на транспорте,"Москва, СВАО, р-н Южное Медведково, м. Бабушкинская, Полярная улица, 4к2",16 950 000 ₽,293 253 ₽/м²
https://www.cian.ru/sale/flat/309201928/,Лучшее предложение в ЖК!,"2-комн. квартира, 69,2 м², 4/14 этаж",Потапово,17 минут пешком,"Москва, НАО (Новомосковский), м. Потапово, бульвар Скандинавский, 12",16 900 000 ₽,244 220 ₽/м²
https://www.cian.ru/sale/flat/311339483/,Отличный вариант!,"2-комн. квартира, 56,9 м², 3/5 этаж",Аэропорт,11 минут пешком,"Москва, САО, р-н Аэропорт, м. Аэропорт, улица Черняховского, 17К3",16 900 000 ₽,297 012 ₽/м²
https://www.cian.ru/sale/flat/302904012/,Если вам нравятся Сталинки,"2-комн. квартира, 65,9 м², 5/5 этаж",Войковская,13 минут пешком,"Москва, САО, р-н Войковский, м. Войковская, 6-й Новоподмосковный переулок, 7",16 990 000 ₽,257 815 ₽/м²
https://www.cian.ru/sale/flat/310559273/,"2-комн. квартира, 51 м², 4/4 этаж",Информация отсутствует,Бескудниково,2 минуты пешком,"Москва, СВАО, р-н Алтуфьевский, м. Бескудниково, Инженерная улица, 34К2",16 950 000 ₽,332 353 ₽/м²
https://www.cian.ru/sale/flat/309201925/,Лучшая квартира в ЖК,"2-комн. квартира, 65 м², 10/16 этаж",Потапово,9 минут пешком,"Москва, НАО (Новомосковский), м. Потапово, Сосенское поселение, Скандинавия ЖК, улица Эдварда Грига, 15",16 900 000 ₽,260 000 ₽/м²
https://www.cian.ru/sale/flat/310915618/,"2-комн.кв., 54.7 м², 9/12 этаж","2-комн. квартира, 54,7 м², 9/12 этаж",Информация отсутствует,20 минут пешком,"Москва, ЗАО, р-н Кунцево, м. Рабочий посёлок, улица Ивана Франко, 32К1",16 900 000 ₽,308 958 ₽/м²
https://www.cian.ru/sale/flat/311232347/,Шикарная 2к.кв с новым ремонтом,"2-комн. квартира, 43 м², 6/12 этаж",Нагорная,8 минут пешком,"Москва, ЮЗАО, р-н Котловка, м. Нагорная, улица Ремизова, 14К1",16 900 000 ₽,393 023 ₽/м²
https://www.cian.ru/sale/flat/311344993/,"Срочно, цена снижена на неделю !","2-комн. квартира, 65 м², 1/10 этаж",Грачёвская,6 минут на транспорте,"Москва, САО, р-н Ховрино, м. Грачёвская, Фестивальная улица, 22К8",17 200 000 ₽,264 615 ₽/м²
https://www.cian.ru/sale/flat/309202937/,"2-комн. квартира, 57,6 м², 4/21 этаж",Информация отсутствует,Перово,8 минут пешком,"Москва, ВАО, р-н Перово, м. Перово, улица Плющева, 15К3",17 400 000 ₽,302 083 ₽/м²
https://www.cian.ru/sale/flat/310636480/,Дом у парка Лосиный остров!,"2-комн. квартира, 64,6 м², 2/25 этаж",Бульвар Рокоссовского,8 минут на транспорте,"Москва, ВАО, р-н Метрогородок, м. Бульвар Рокоссовского, Открытое шоссе, 30",17 500 000 ₽,270 898 ₽/м²
https://www.cian.ru/sale/flat/310317387/,Выгодное предложение,"2-комн. квартира, 52 м², 4/14 этаж",Площадь Ильича,10 минут пешком,"Москва, ЮВАО, р-н Лефортово, м. Площадь Ильича, Волочаевская улица, 13",17 500 000 ₽,336 538 ₽/м²
https://www.cian.ru/sale/flat/309941020/,Лучшая цена в локации,"2-комн. квартира, 46,4 м², 4/9 этаж",Новаторская,15 минут пешком,"Москва, ЮЗАО, р-н Ломоносовский, м. Вавиловская, Ленинский проспект, 85",17 900 000 ₽,385 776 ₽/м²
https://www.cian.ru/sale/flat/309215528/,2 комн. кв-ра с евро ремонтом.,"2-комн. квартира, 43 м², 6/9 этаж",Аэропорт,12 минут пешком,"Москва, САО, р-н Аэропорт, м. Аэропорт, улица Пилота Нестерова, 7",17 900 000 ₽,416 279 ₽/м²
https://www.cian.ru/sale/flat/311251309/,Роскошная квартира на новый год!,"2-комн. квартира, 52,4 м², 5/12 этаж",Улица Академика Янгеля,7 минут пешком,"Москва, ЮАО, р-н Чертаново Южное, м. Улица Академика Янгеля, Россошанский проезд, 2К3",17 900 000 ₽,341 603 ₽/м²
https://www.cian.ru/sale/flat/310641597/,"Двушка с ремонтом, Академическая!","2-комн. квартира, 45 м², 3/9 этаж",Профсоюзная,12 минут пешком,"Москва, ЮЗАО, р-н Академический, м. Профсоюзная, Новочеремушкинская улица, 24",18 190 000 ₽,404 222 ₽/м²
https://www.cian.ru/sale/flat/303979379/,"2-комн. квартира, 41,09 м², 7/28 этаж",Информация отсутствует,Нагатинская,5 минут пешком,"Москва, ЮАО, р-н Нагатино-Садовники, м. Нагатинская, Нагатинская улица, к1вл1",18 400 000 ₽,447 798 ₽/м²
https://www.cian.ru/sale/flat/310947517/,"2-комн. квартира, 55,9 м², 7/30 этаж",Информация отсутствует,Трикотажная,4 минуты на транспорте,"Москва, СЗАО, р-н Покровское-Стрешнево, м. Трикотажная, Строительный проезд, 9С9",18 300 000 ₽,327 370 ₽/м²
https://www.cian.ru/sale/flat/311195142/,Лучшая цена!,"2-комн. квартира, 53,4 м², 8/17 этаж",Тульская,7 минут пешком,"Москва, ЮАО, р-н Донской, м. Тульская, Большая Тульская улица, 54",18 500 000 ₽,346 442 ₽/м²
https://www.cian.ru/sale/flat/311247985/,не хватает только ваших вещей!,"2-комн. квартира, 58 м², 24/25 этаж",Рассказовка,9 минут на транспорте,"Москва, НАО (Новомосковский), м. Рассказовка, Московский г., улица Никитина, 11к7",18 500 000 ₽,318 966 ₽/м²
https://www.cian.ru/sale/flat/309805122/,"2-комн. квартира, 46,1 м², 10/14 этаж",Информация отсутствует,Тульская,13 минут пешком,"Москва, ЮАО, р-н Даниловский, м. Тульская, 3-я Рощинская улица, 12/18",18 800 000 ₽,407 809 ₽/м²
https://www.cian.ru/sale/flat/300787656/,Классная современная квартира!,"2-комн. квартира, 60 м², 18/24 этаж",Пятницкое шоссе,5 минут на транспорте,"Москва, СЗАО, р-н Митино, м. Пятницкое шоссе, Муравская улица, 44к2",18 800 000 ₽,313 333 ₽/м²
https://www.cian.ru/sale/flat/310548567/,Комплекс на берегу двух рек!,"2-комн. апартаменты, 57,8 м², 5/25 этаж",Тушинская,5 минут на транспорте,"Москва, СЗАО, р-н Покровское-Стрешнево, м. Трикотажная, Волоколамское шоссе, 81/2с3",18 850 000 ₽,326 125 ₽/м²
https://www.cian.ru/sale/flat/311361734/,"2-комн. квартира, 54 м², 10/17 этаж",Информация отсутствует,Хорошёвская,9 минут пешком,"Москва, САО, р-н Хорошевский, м. Хорошёвская, Хорошевское шоссе, 60",18 900 000 ₽,350 000 ₽/м²
https://www.cian.ru/sale/flat/309464795/,Квартира с мебелью и техникой!!!,"2-комн. квартира, 59,8 м², 11/24 этаж",Филатов Луг,10 минут на транспорте,"Москва, НАО (Новомосковский), м. Филатов Луг, Московский г., улица Никитина, 11к11",19 000 000 ₽,317 726 ₽/м²
https://www.cian.ru/sale/flat/311375972/,"2-комн. квартира, 58,3 м², 7/7 этаж",Информация отсутствует,Октябрьское поле,4 минуты пешком,"Москва, СЗАО, р-н Щукино, м. Октябрьское поле, улица Маршала Бирюзова, 7",18 900 000 ₽,324 185 ₽/м²
https://www.cian.ru/sale/flat/310730890/,Евро-2к апартаменты,"2-комн. апартаменты, 53 м², 16/22 этаж",Давыдково,12 минут пешком,"Москва, ЗАО, р-н Очаково-Матвеевское, м. Давыдково, Аминьевское шоссе, 6",18 900 000 ₽,356 604 ₽/м²
https://www.cian.ru/sale/flat/307560622/,"Только здесь ипотека 9,4%!!!","2-комн. квартира, 58,5 м², 10/24 этаж",Стахановская,8 минут пешком,"Москва, ЮВАО, р-н Рязанский, м. Стахановская, 2-й Грайвороновский проезд, 42к2",19 000 000 ₽,324 786 ₽/м²
https://www.cian.ru/sale/flat/310948069/,"2-комн. квартира, 55 м², 22/25 этаж",Информация отсутствует,Семёновская,8 минут пешком,"Москва, ВАО, р-н Соколиная гора, м. Семёновская, Измайловское шоссе, 6",18 900 000 ₽,343 636 ₽/м²
https://www.cian.ru/sale/flat/303329368/,Квартира с высокими потолками,"2-комн. квартира, 66,5 м², 4/5 этаж",Октябрьское поле,10 минут пешком,"Москва, СЗАО, р-н Щукино, м. Октябрьское поле, улица Расплетина, 12К2",19 300 000 ₽,290 226 ₽/м²
https://www.cian.ru/sale/flat/309834539/,"2-комн. квартира, 43 м², 10/26 этаж",Информация отсутствует,Алексеевская,8 минут пешком,"Москва, СВАО, р-н Останкинский, м. Алексеевская, улица Бочкова, 11АС1",19 300 000 ₽,448 837 ₽/м²
https://www.cian.ru/sale/flat/295454414/,Корпус Премиум! Высокие потолки!,"2-комн. квартира, 37,4 м², 51/54 этаж",Информация отсутствует,11 минут пешком,"Москва, ЗАО, р-н Очаково-Матвеевское, м. Мичуринский проспект, Левел Мичуринский ЖК, к1",19 390 000 ₽,518 449 ₽/м²
https://www.cian.ru/sale/flat/308993929/,3смарт в ЖК Новохохловская 15,"2-комн. квартира, 62,3 м², 6/33 этаж",Новохохловская,6 минут пешком,"Москва, ЮВАО, р-н Нижегородский, м. Новохохловская, Новохохловская улица, 15к1",19 300 000 ₽,309 791 ₽/м²
https://www.cian.ru/sale/flat/308536673/,Евро! Лучшая квартира в районе!,"2-комн. квартира, 48 м², 4/8 этаж",Шелепиха,8 минут пешком,"Москва, ЦАО, р-н Пресненский, м. Шелепиха, Шелепихинская набережная, 12",19 500 000 ₽,406 250 ₽/м²
https://www.cian.ru/sale/flat/301005114/,Свежайший ремонт! Все новое!,"2-комн. квартира, 60 м², 20/24 этаж",Пятницкое шоссе,5 минут на транспорте,"Москва, СЗАО, р-н Митино, м. Пятницкое шоссе, Муравская улица, 44к2",19 500 000 ₽,325 000 ₽/м²
https://www.cian.ru/sale/flat/311146799/,"Продается 2-комн. квартира, 63 м²","2-комн. квартира, 63 м², 10/17 этаж",Войковская,19 минут пешком,"Москва, САО, р-н Войковский, м. Балтийская, Нарвская улица, 1Ак2",19 700 000 ₽,312 698 ₽/м²
https://www.cian.ru/sale/flat/310748420/,Лучшее предложение в районе!,"2-комн. квартира, 53,5 м², 5/5 этаж",Динамо,5 минут пешком,"Москва, САО, р-н Беговой, м. Динамо, Ленинградский проспект, 33К9",19 790 000 ₽,369 907 ₽/м²
https://www.cian.ru/sale/flat/310964374/,"2-комн. квартира, 44 м², 4/5 этаж",Информация отсутствует,Информация отсутствует,15 минут пешком,"Москва, ЮЗАО, р-н Академический, м. Крымская, улица Винокурова, 11К2",19 700 000 ₽,447 727 ₽/м²
https://www.cian.ru/sale/flat/309816572/,Доступна рассрочка без %,"2-комн. апартаменты, 54,7 м², 4/11 этаж",Информация отсутствует,6 минут пешком,"Москва, САО, р-н Савеловский, м. Савёловская, улица Нижняя Масловка, 10Б",19 692 000 ₽,360 000 ₽/м²
https://www.cian.ru/sale/flat/311298419/,Дизайнерский ремонт!,"2-комн. квартира, 58 м², 2/5 этаж",Петровский Парк,13 минут пешком,"Москва, САО, р-н Савеловский, м. Гражданская, улица Юннатов, 6к1",19 990 000 ₽,344 655 ₽/м²
https://www.cian.ru/sale/flat/310470983/,"2-комн. квартира, 48 м², 12/12 этаж",Информация отсутствует,Чкаловская,4 минуты пешком,"Москва, ЦАО, р-н Таганский, м. Чкаловская, улица Земляной Вал, 41С1",19 899 999 ₽,414 583 ₽/м²
https://www.cian.ru/sale/flat/309593772/,2к в 10 минутах от метро,"2-комн. квартира, 51,1 м², 2/17 этаж",Каховская,13 минут пешком,"Москва, ЮЗАО, р-н Зюзино, м. Каховская, Болотниковская улица, 36к1",20 000 000 ₽,391 389 ₽/м²
https://www.cian.ru/sale/flat/309119353/,"2-комн. квартира, 55,5 м², 4/15 этаж",Информация отсутствует,Красносельская,10 минут пешком,"Москва, ЦАО, р-н Красносельский, м. Красносельская, Верхняя Красносельская улица, 8К2",20 000 000 ₽,360 360 ₽/м²
https://www.cian.ru/sale/flat/311191587/,Выгодное предложение района,"2-комн. квартира, 52,4 м², 2/34 этаж",Аминьевская,10 минут пешком,"Москва, ЗАО, р-н Очаково-Матвеевское, м. Аминьевская, Очаковское шоссе, 5к1",20 300 000 ₽,387 405 ₽/м²
https://www.cian.ru/sale/flat/309402624/,"2-комн. квартира, 56,4 м², 10/17 этаж",Информация отсутствует,Коньково,4 минуты пешком,"Москва, ЮЗАО, р-н Коньково, м. Коньково, улица Островитянова, 25К1",20 500 000 ₽,363 475 ₽/м²
https://www.cian.ru/sale/flat/310716693/,"2-к. кв., 52.6 м², 18/21 эт.","2-комн. квартира, 52,6 м², 18/21 этаж",Селигерская,19 минут пешком,"Москва, САО, р-н Дмитровский, м. Яхромская, Дмитровское шоссе, 107к1",20 500 000 ₽,389 734 ₽/м²
https://www.cian.ru/sale/flat/309593771/,2к рядом с метро,"2-комн. квартира, 50,8 м², 2/17 этаж",Нахимовский проспект,12 минут пешком,"Москва, ЮЗАО, р-н Зюзино, м. Нахимовский проспект, Болотниковская улица, 36к2",20 500 000 ₽,403 543 ₽/м²
https://www.cian.ru/sale/flat/297413640/,"2-комн. апартаменты, 69,2 м², 11/14 этаж",Секция 2 • Сдан,Тёплый Стан,10 минут пешком,"Москва, ЮЗАО, р-н Ясенево, м. Тёплый Стан, Новоясеневский проспект, 3В",20 490 120 ₽,296 100 ₽/м²
https://www.cian.ru/sale/flat/309817409/,Доступна рассрочка без %,"2-комн. апартаменты, 54,6 м², 7/11 этаж",Информация отсутствует,6 минут пешком,"Москва, САО, р-н Савеловский, м. Савёловская, улица Нижняя Масловка, 10Б",20 748 000 ₽,380 000 ₽/м²
https://www.cian.ru/sale/flat/306955636/,Ключ к счастью.,"2-комн. квартира, 56 м², 10/18 этаж",Планерная,18 минут пешком,"Москва, СЗАО, р-н Северное Тушино, м. Сходненская, Туристская улица, 14",20 600 000 ₽,367 857 ₽/м²
https://www.cian.ru/sale/flat/310531029/,Срочная продажа! ЖК Moments,"2-комн. квартира, 42,4 м², 17/40 этаж",Войковская,19 минут пешком,"Москва, СЗАО, р-н Щукино, м. Стрешнево, Моментс ЖК, к2.1",20 750 000 ₽,489 387 ₽/м²
https://www.cian.ru/sale/flat/297413612/,"2-комн. апартаменты, 84,1 м², 1/14 этаж",Секция 1 • Сдан,Тёплый Стан,15 минут пешком,"Москва, ЮЗАО, р-н Ясенево, м. Тёплый Стан, Новоясеневский проспект, 3В",20 732 387 ₽,246 521 ₽/м²
https://www.cian.ru/sale/flat/307360950/,"2-комн. квартира, 57,2 м², 2/8 этаж",Информация отсутствует,Информация отсутствует,11 минут пешком,"Москва, ЮЗАО, р-н Ломоносовский, м. Новаторская, Ленинский проспект, 90",20 800 000 ₽,363 636 ₽/м²
