Ссылка,Название,Описание,Метро,Дальность от метро,Адрес,Стоимость,Стоимость за метр
https://www.cian.ru/sale/flat/311448486/,Дизайнерский ремонт. Метро 1 мин.,"2-комн. квартира, 86 м², 7/32 этаж",Беговая,3 минуты пешком,"Москва, САО, р-н Хорошевский, м. Беговая, Хорошевское шоссе, 12к1",36 000 000 ₽,418 605 ₽/м²
https://www.cian.ru/sale/flat/310930922/,Виды на реку,"2-комн. квартира, 77 м², 4/9 этаж",Киевская,10 минут пешком,"Москва, ЦАО, р-н Хамовники, м. Киевская, Саввинская набережная, 3",60 000 000 ₽,779 221 ₽/м²
https://www.cian.ru/sale/flat/291011346/,"2-комн. квартира, 52,4 м², 2/28 этаж",Секция 3 • Сдача корпуса 4 кв. 2026,Зорге,5 минут пешком,"Москва, САО, р-н Хорошевский, м. Зорге, Инди Тауэрс ЖК",27 042 173 ₽,516 072 ₽/м²
https://www.cian.ru/sale/flat/310462581/,Новый дизайнерский ремонт,"2-комн. квартира, 69 м², 5/10 этаж",Смоленская,2 минуты пешком,"Москва, ЦАО, р-н Арбат, м. Смоленская, Смоленская площадь, 13/21",74 350 000 ₽,1 077 536 ₽/м²
https://www.cian.ru/sale/flat/311132969/,"Стильный, видовой лофт ""под ключ""","2-комн. апартаменты, 75,7 м², 4/4 этаж",Информация отсутствует,8 минут пешком,"Москва, СВАО, р-н Марьина роща, м. Марьина Роща, проезд 12-й Марьиной рощи, 8С2",34 900 000 ₽,461 030 ₽/м²
https://www.cian.ru/sale/flat/305914265/,"2-комн. квартира, 49,8 м², 2/24 этаж",Сдача корпуса 4 кв. 2027,Сокольники,14 минут пешком,"Москва, ВАО, р-н Сокольники, м. Сокольники, улица Гастелло",20 741 700 ₽,416 500 ₽/м²
https://www.cian.ru/sale/flat/310634500/,Продается двухкомнатная квартира,"2-комн. квартира, 54,8 м², 1/12 этаж",Информация отсутствует,11 минут пешком,"Москва, ВАО, р-н Новогиреево, м. Перово, Новогиреевская улица, 50/9",14 200 000 ₽,259 124 ₽/м²
https://www.cian.ru/sale/flat/302032393/,"2-комн. квартира, 45,2 м², 9/9 этаж",Информация отсутствует,Беляево,8 минут пешком,"Москва, ЮЗАО, р-н Коньково, м. Беляево, улица Генерала Антонова, 5К1",13 413 600 ₽,296 761 ₽/м²
https://www.cian.ru/sale/flat/308416300/,"2-комн. квартира, 42,8 м², 8/9 этаж",Сдача корпуса 4 кв. 2024,Марьина Роща,8 минут пешком,"Москва, СВАО, р-н Марьина роща, м. Марьина Роща, Мод ЖК",29 005 560 ₽,677 700 ₽/м²
https://www.cian.ru/sale/flat/305062355/,Апартамент с видом на реку,"2-комн. апартаменты, 114,2 м², 46/75 этаж",Информация отсутствует,7 минут пешком,"Москва, ЦАО, р-н Пресненский, м. Деловой центр, 1-й Красногвардейский проезд, 15",86 000 000 ₽,753 065 ₽/м²
https://www.cian.ru/sale/flat/293510493/,Видовая кв-ра в Раменках!,"2-комн. квартира, 87,2 м², 8/22 этаж",Поклонная,16 минут пешком,"Москва, ЗАО, р-н Раменки, м. Поклонная, улица Пырьева, 9К1",38 000 000 ₽,435 780 ₽/м²
https://www.cian.ru/sale/flat/304483045/,"2-комн. апартаменты, 110,8 м², 9/13 этаж",Секция 3 • Сдан,Смоленская,7 минут пешком,"Москва, ЦАО, р-н Арбат, м. Смоленская, улица Новый Арбат, 32",102 030 013 ₽,920 848 ₽/м²
https://www.cian.ru/sale/flat/311189608/,В зелёном районе,"2-комн. квартира, 73,5 м², 20/21 этаж",Раменки,11 минут пешком,"Москва, ЗАО, р-н Раменки, м. Раменки, Мосфильмовская улица, 88к4с2",46 900 000 ₽,638 095 ₽/м²
https://www.cian.ru/sale/flat/298704645/,Под отделку. Просторная Двушка!,"2-комн. квартира, 62 м², 12/38 этаж",Щукинская,11 минут пешком,"Москва, СЗАО, р-н Щукино, м. Щукинская, Авиационная улица, 77к2",31 990 000 ₽,515 968 ₽/м²
https://www.cian.ru/sale/flat/300866286/,"2-комн. квартира, 64 м², 8/75 этаж",Секция Корпус 1 • Сдача корпуса 3 кв. 2026,Площадь Гагарина,9 минут пешком,"Москва, ЮАО, р-н Донской, м. Площадь Гагарина, 5-й Донской проезд, вл21к6",33 719 360 ₽,526 865 ₽/м²
https://www.cian.ru/sale/flat/298842309/,Новый дом в Донском районе,"2-комн. квартира, 41 м², 7/21 этаж",Шаболовская,8 минут пешком,"Москва, ЦАО, р-н Якиманка, м. Шаболовская, Донская улица, 14",55 000 000 ₽,1 341 463 ₽/м²
https://www.cian.ru/sale/flat/304516413/,"2-комн. квартира, 38,2 м², 1/12 этаж",Информация отсутствует,Зюзино,6 минут пешком,"Москва, ЮЗАО, р-н Черемушки, м. Зюзино, улица Каховка, 22К5",10 700 000 ₽,280 105 ₽/м²
https://www.cian.ru/sale/flat/291740133/,"2-комн. квартира, 67,9 м², 2/16 этаж",Секция 1 • Сдача корпуса 2 кв. 2025,Свиблово,10 минут пешком,"Москва, СВАО, р-н Свиблово, м. Свиблово, Снежная улица, вл22к3",31 678 745 ₽,466 550 ₽/м²
https://www.cian.ru/sale/flat/310726337/,Срочная продажа! 1-я линия,"2-комн. квартира, 46,3 м², 7/11 этаж",Терехово ,19 минут пешком,"Москва, СЗАО, р-н Хорошево-Мневники, м. Терехово , Жилой комплекс остров, 4-й кв-л",22 700 000 ₽,490 281 ₽/м²
https://www.cian.ru/sale/flat/310454568/,Тишина и спокойствие!,"2-комн. квартира, 76,4 м², 4/5 этаж",Сретенский бульвар,7 минут пешком,"Москва, ЦАО, р-н Мещанский, м. Трубная, Рождественский бульвар, 17",48 000 000 ₽,628 272 ₽/м²
https://www.cian.ru/sale/flat/308884311/,"2-комн. квартира, 47,3 м², 45/53 этаж",Сдан,Ботанический сад,11 минут пешком,"Москва, СВАО, р-н Свиблово, м. Ботанический сад, проезд Серебрякова, 11к2",22 483 329 ₽,475 335 ₽/м²
https://www.cian.ru/sale/flat/311267004/,"2-комн. квартира, 62,7 м², 2/22 этаж",Информация отсутствует,Терехово ,5 минут на транспорте,"Москва, СЗАО, р-н Хорошево-Мневники, м. Терехово , улица Нижние Мневники, 16к3",28 500 000 ₽,454 545 ₽/м²
https://www.cian.ru/sale/flat/310574086/,"2-комн. квартира, 62,5 м², 5/9 этаж",Информация отсутствует,ЗИЛ,8 минут на транспорте,"Москва, ЮАО, р-н Даниловский, м. ЗИЛ, набережная Марка Шагала, 11к2",23 500 000 ₽,376 000 ₽/м²
https://www.cian.ru/sale/flat/308965721/,"2-комн. квартира, 51,9 м², 2/18 этаж",Сдача корпуса 1 кв. 2028,Октябрьское поле,8 минут пешком,"Москва, СЗАО, р-н Щукино, м. Зорге, улица Маршала Бирюзова, 1к14",22 847 521 ₽,440 222 ₽/м²
https://www.cian.ru/sale/flat/309923956/,ЖК Зорге 9,"2-комн. квартира, 70 м², 4/23 этаж",Полежаевская,13 минут пешком,"Москва, САО, р-н Хорошевский, м. Зорге, улица Зорге, 9Ак1",45 000 000 ₽,642 857 ₽/м²
https://www.cian.ru/sale/flat/311419797/,"2-комн. квартира, 54,2 м², 2/4 этаж",Информация отсутствует,Новокузнецкая,10 минут пешком,"Москва, ЦАО, р-н Замоскворечье, м. Новокузнецкая, 2-й Раушский переулок, 3",47 154 000 ₽,870 000 ₽/м²
https://www.cian.ru/sale/flat/310903740/,"2-комн. квартира, 50,7 м², 13/28 этаж",Секция 1 • Сдача корпуса 4 кв. 2026,Информация отсутствует,5 минут на транспорте,"Москва, СЗАО, р-н Хорошево-Мневники, м. Народное Ополчение, улица Генерала Глаголева",23 017 800 ₽,454 000 ₽/м²
https://www.cian.ru/sale/flat/309616186/,Квартира для двоих,"2-комн. квартира, 144 м², 14/21 этаж",Улица 1905 года,16 минут пешком,"Москва, ЦАО, р-н Пресненский, м. Улица 1905 года, улица Сергея Макеева, 9",150 000 000 ₽,1 041 667 ₽/м²
https://www.cian.ru/sale/flat/308886251/,"2-комн. квартира, 59,1 м², 19/22 этаж",Информация отсутствует,Тёплый Стан,9 минут пешком,"Москва, ЮЗАО, р-н Теплый Стан, м. Тёплый Стан, Профсоюзная улица, 142",19 000 000 ₽,321 489 ₽/м²
https://www.cian.ru/sale/flat/310459264/,"Рассрочка 0%. 2-к. кв., 54.5 м2","2-комн. квартира, 54,5 м², 2/25 этаж • Секция 4",Семёновская,20 минут пешком,"Москва, ВАО, р-н Соколиная гора, м. Соколиная гора, 1-й Кирпичный переулок, 17",18 391 890 ₽,337 466 ₽/м²
https://www.cian.ru/sale/flat/309340535/,"2-комн. квартира, 88 м², 23/34 этаж",Информация отсутствует,Шелепиха,14 минут пешком,"Москва, СЗАО, р-н Хорошево-Мневники, м. Шелепиха, Шелепихинская набережная, 34к3зд7",73 500 000 ₽,835 227 ₽/м²
https://www.cian.ru/sale/flat/307586146/,СрочнаЯ продажа! Цена отличная!,"2-комн. квартира, 53,5 м², 11/14 этаж",Ольховая,20 минут на транспорте,"Москва, НАО (Новомосковский), м. Ольховая, Новые Ватутинки жилрайон, Заречный мкр, 5/3",10 900 000 ₽,203 738 ₽/м²
https://www.cian.ru/sale/flat/304955152/,"2-комн. апартаменты, 35,32 м², 2/20 этаж",Секция 1 • Сдача корпуса 2 кв. 2026,Преображенская площадь,17 минут пешком,"Москва, ВАО, р-н Преображенское, м. Преображенская площадь, Потешная улица",12 362 000 ₽,350 000 ₽/м²
https://www.cian.ru/sale/flat/308239254/,Новый дизайнерский ремонт,"2-комн. квартира, 84 м², 12/19 этаж",Шелепиха,18 минут пешком,"Москва, СЗАО, р-н Хорошево-Мневники, м. Шелепиха, Шелепихинская набережная, 34к2",59 000 000 ₽,702 381 ₽/м²
https://www.cian.ru/sale/flat/309772623/,"2-комн. квартира, 54 м², 5/7 этаж",Информация отсутствует,Кутузовская,7 минут пешком,"Москва, ЗАО, р-н Дорогомилово, м. Кутузовская, Кутузовский проспект, 26К1",31 000 000 ₽,574 074 ₽/м²
https://www.cian.ru/sale/flat/311263116/,"2-комн. квартира, 45,5 м², 13/33 этаж",Сдан,Шелепиха,10 минут пешком,"Москва, СЗАО, р-н Хорошево-Мневники, м. Шелепиха, Причальный проезд, 10к1",25 337 193 ₽,556 861 ₽/м²
https://www.cian.ru/sale/flat/311151995/,Новая! Готова к переезду!,"2-комн. апартаменты, 72,1 м², 6/12 этаж",Маяковская,5 минут пешком,"Москва, ЦАО, р-н Тверской, м. Маяковская, 2-я Брестская улица, 6",56 000 000 ₽,776 699 ₽/м²
https://www.cian.ru/sale/flat/310041544/,Готовая уютная евродвушка ! Топ!,"2-комн. квартира, 62,2 м², 10/15 этаж",Динамо,7 минут пешком,"Москва, САО, р-н Беговой, м. Динамо, Ленинградский проспект, 29к3",37 999 999 ₽,610 932 ₽/м²
https://www.cian.ru/sale/flat/310686576/,"2-комн. квартира, 158,4 м², 4/5 этаж",Сдан,Полянка,6 минут пешком,"Москва, ЦАО, р-н Якиманка, м. Полянка, Старомонетный переулок, 19/11С1",586 080 000 ₽,3 700 000 ₽/м²
https://www.cian.ru/sale/flat/308888845/,Лучшая инвестиция на Тверской,"2-комн. апартаменты, 78,6 м², 10/12 этаж",Маяковская,5 минут пешком,"Москва, ЦАО, р-н Тверской, м. Маяковская, 2-я Брестская улица, 6",43 800 000 ₽,557 252 ₽/м²
https://www.cian.ru/sale/flat/288302820/,Идеальная локация,"2-комн. квартира, 119,1 м², 5/5 этаж",Кузнецкий мост,3 минуты пешком,"Москва, ЦАО, р-н Мещанский, м. Кузнецкий мост, Варсонофьевский переулок, 4С1",75 000 000 ₽,629 723 ₽/м²
https://www.cian.ru/sale/flat/300878826/,"2-комн. квартира, 50,4 м², 4/12 этаж",Секция 1 • Сдача корпуса 3 кв. 2026,Преображенская площадь,5 минут пешком,"Москва, ВАО, р-н Преображенское, м. Преображенская площадь, Электрозаводская улица, 60",27 616 226 ₽,547 941 ₽/м²
https://www.cian.ru/sale/flat/306102816/,"Лучшая цена, вид на воду!","2-комн. квартира, 75,4 м², 6/11 этаж",ЗИЛ,8 минут на транспорте,"Москва, ЮАО, р-н Даниловский, м. ЗИЛ, набережная Марка Шагала, 11к2",29 000 000 ₽,384 615 ₽/м²
https://www.cian.ru/sale/flat/307107534/,Выгодное предложение,"2-комн. квартира, 68 м², 11/16 этаж",Информация отсутствует,14 минут пешком,"Москва, ЗАО, р-н Очаково-Матвеевское, м. Матвеевская, Матвеевская улица, 4К1",19 000 000 ₽,279 412 ₽/м²
https://www.cian.ru/sale/flat/302037458/,"2-комн. квартира, 63,4 м², 2/46 этаж",Секция 1 • Сдача корпуса 3 кв. 2026,Фили,7 минут пешком,"Москва, ЗАО, р-н Дорогомилово, м. Фили, Кутузовский проезд, 16А/1",45 595 270 ₽,719 168 ₽/м²
https://www.cian.ru/sale/flat/311331702/,"Новая и стильная, дровяной камин","2-комн. квартира, 96 м², 6/8 этаж",Парк Культуры,12 минут пешком,"Москва, ЦАО, р-н Хамовники, м. Парк Культуры, улица Льва Толстого, 23к1",257 000 000 ₽,2 677 083 ₽/м²
https://www.cian.ru/sale/flat/311331617/,Лучшее предложение! Звони!,"2-комн. квартира, 49 м², 14/41 этаж",Кутузовская,17 минут пешком,"Москва, ЗАО, р-н Раменки, м. Кутузовская, Хайд ЖК, Парклэйн тер., к2",29 900 000 ₽,610 204 ₽/м²
https://www.cian.ru/sale/flat/311253385/,"2-комн. квартира, 42,4 м², 11/11 этаж",Секция 2 • Сдача корпуса 4 кв. 2025,Бауманская,16 минут пешком,"Москва, ЦАО, р-н Басманный, м. Бауманская, Большая Почтовая улица, кА",33 399 304 ₽,787 719 ₽/м²
https://www.cian.ru/sale/flat/310714193/,Виды на парк и воду. Новый ремонт,"2-комн. апартаменты, 47 м², 10/14 этаж",Информация отсутствует,15 минут пешком,"Москва, ЗАО, р-н Раменки, м. Минская, проспект Генерала Дорохова, 39к2И",45 000 000 ₽,957 447 ₽/м²
https://www.cian.ru/sale/flat/310866371/,Двушка под ключ в новом доме!,"2-комн. квартира, 53,4 м², 3/4 этаж",Информация отсутствует,Информация отсутствует,"Москва, ТАО (Троицкий), Троицк, улица Георгия Скребицкого, 7",10 840 000 ₽,202 996 ₽/м²
https://www.cian.ru/sale/flat/310509665/,"2-комн. квартира, 40 м², 25/28 этаж",Секция 2 • Сдача корпуса 1 кв. 2025,Коптево,8 минут пешком,"Москва, САО, р-н Головинский, м. Коптево, Михалковская улица, 50",21 200 000 ₽,530 000 ₽/м²
https://www.cian.ru/sale/flat/307649399/,"2-комн. квартира, 69 м², 14/14 этаж",Информация отсутствует,Информация отсутствует,5 минут на транспорте,"Москва, ЗАО, р-н Раменки, м. Поклонная, проспект Генерала Дорохова, 39к1Б",62 988 700 ₽,912 880 ₽/м²
https://www.cian.ru/sale/flat/311052893/,Дизайнерская! Лифт!,"2-комн. квартира, 62 м², 3/5 этаж",Спортивная,6 минут пешком,"Москва, ЦАО, р-н Хамовники, м. Спортивная, Кооперативная улица, 10",34 500 000 ₽,556 452 ₽/м²
https://www.cian.ru/sale/flat/308063655/,"2-комн. апартаменты, 39,8 м², 2/18 этаж",Секция к. 1 • Сдача корпуса 4 кв. 2025,Шоссе Энтузиастов,5 минут пешком,"Москва, ВАО, р-н Перово, м. Шоссе Энтузиастов, Электродная улица",11 303 200 ₽,284 000 ₽/м²
https://www.cian.ru/sale/flat/310470593/,Панорамные окна и живописные виды,"2-комн. апартаменты, 102,6 м², 19/34 этаж",Парк Победы,17 минут пешком,"Москва, ЗАО, р-н Дорогомилово, м. Поклонная, Поклонная улица, 9",150 000 000 ₽,1 461 988 ₽/м²
https://www.cian.ru/sale/flat/307996388/,Ремонт I Тихо I Хамовники,"2-комн. квартира, 56,6 м², 2/5 этаж",Парк Культуры,8 минут пешком,"Москва, ЦАО, р-н Хамовники, м. Парк Культуры, Комсомольский проспект, 14/1К3",38 500 000 ₽,680 212 ₽/м²
https://www.cian.ru/sale/flat/293803976/,Выгодная инвестиция в будущее,"2-комн. апартаменты, 38,3 м², 3/36 этаж • Секция 1",Ростокино,12 минут пешком,"Москва, СВАО, р-н Ярославский, м. Ростокино, проспект Мира, 222",11 260 200 ₽,294 000 ₽/м²
https://www.cian.ru/sale/flat/310842172/,Тихая видовая квартира,"2-комн. квартира, 70,8 м², 12/21 этаж",Улица 1905 года,7 минут пешком,"Москва, ЦАО, р-н Пресненский, м. Улица 1905 года, улица Костикова, 4к1",82 000 000 ₽,1 158 192 ₽/м²
https://www.cian.ru/sale/flat/309998487/,Панорамные окна и живописные виды,"2-комн. квартира, 50,8 м², 14/23 этаж",Давыдково,17 минут пешком,"Москва, ЗАО, р-н Можайский, м. Давыдково, Гжатская улица, 5к4",27 100 000 ₽,533 465 ₽/м²
https://www.cian.ru/sale/flat/310644090/,"Рассрочка 0% на апарт., 42.1 м²","2-комн. апартаменты, 42,1 м², 2/29 этаж • Секция 3",Новые Черёмушки,11 минут пешком,"Москва, ЮЗАО, р-н Черемушки, м. Новые Черёмушки, улица Наметкина, вл10",14 145 600 ₽,336 000 ₽/м²
https://www.cian.ru/sale/flat/307850573/,Срочная продажа,"2-комн. квартира, 62,7 м², 2/23 этаж",Терехово ,5 минут на транспорте,"Москва, СЗАО, р-н Хорошево-Мневники, м. Терехово , улица Нижние Мневники, 16к3",28 500 000 ₽,454 545 ₽/м²
https://www.cian.ru/sale/flat/308855240/,Уютная 2х комнатная квартира,"2-комн. квартира, 54 м², 6/17 этаж",Крылатское,8 минут пешком,"Москва, ЗАО, р-н Крылатское, м. Крылатское, улица Крылатские Холмы, 27К2",23 500 000 ₽,435 185 ₽/м²
https://www.cian.ru/sale/flat/294550035/,"2-комн. квартира, 47,7 м², 3/25 этаж",Секция 1 • Сдан,Воронцовская,8 минут пешком,"Москва, ЮЗАО, р-н Обручевский, м. Воронцовская, Афи Парк Воронцовский ЖК, 4",22 925 381 ₽,480 616 ₽/м²
https://www.cian.ru/sale/flat/306237450/,Двушка в 2-х минутах от м ЦСКА!,"2-комн. апартаменты, 45,1 м², 3/15 этаж",ЦСКА,6 минут пешком,"Москва, САО, р-н Хорошевский, м. ЦСКА, Ходынский бульвар, 2",17 225 000 ₽,381 929 ₽/м²
https://www.cian.ru/sale/flat/306773108/,"2-комн. апартаменты, 82,1 м², 7/18 этаж",Информация отсутствует,Нагатинский Затон,20 минут пешком,"Москва, ЮАО, р-н Нагатинский затон, м. Нагатинский Затон, улица Корабельная, 9",37 700 000 ₽,459 196 ₽/м²
https://www.cian.ru/sale/flat/311389976/,"2-комн. квартира, 38,7 м², 4/25 этаж",Секция 2 • Сдача корпуса 1 кв. 2026,Бульвар Рокоссовского,6 минут на транспорте,"Москва, ВАО, р-н Метрогородок, м. Бульвар Рокоссовского, Сиреневый парк ЖК",16 270 333 ₽,420 422 ₽/м²
https://www.cian.ru/sale/flat/308454849/,Апартаменты на Ходынке,"2-комн. апартаменты, 45,1 м², 3/15 этаж",ЦСКА,6 минут пешком,"Москва, САО, р-н Хорошевский, м. ЦСКА, Ходынский бульвар, 2",17 225 985 ₽,381 951 ₽/м²
https://www.cian.ru/sale/flat/310867997/,Свободная продажа!,"2-комн. квартира, 76 м², 9/14 этаж",ЗИЛ,14 минут пешком,"Москва, ЮАО, р-н Даниловский, м. ЗИЛ, улица Архитектора Щусева, 2к2",41 490 000 ₽,545 921 ₽/м²
https://www.cian.ru/sale/flat/305101588/,"2-комн. квартира, 58,66 м², 6/46 этаж",Секция 3 • Сдача корпуса 2 кв. 2027,Бутырская,6 минут пешком,"Москва, СВАО, р-н Бутырский, м. Бутырская, Огородный проезд",27 866 463 ₽,475 051 ₽/м²
https://www.cian.ru/sale/flat/301655618/,"Отделка white box, эксклюзив","2-комн. квартира, 74,13 м², 2/11 этаж",Парк Победы,8 минут пешком,"Москва, ЗАО, р-н Дорогомилово, м. Парк Победы, Виктори Парк Резиденсез ЖК, 3к2",100 000 000 ₽,1 348 982 ₽/м²
https://www.cian.ru/sale/flat/306015204/,Отличное предложение!,"2-комн. квартира, 58,8 м², 1/5 этаж",Марксистская,5 минут пешком,"Москва, ЦАО, р-н Таганский, м. Марксистская, Таганская улица, 24С5",24 400 000 ₽,414 966 ₽/м²
https://www.cian.ru/sale/flat/309403148/,"2-комн. квартира, 41 м², 3/17 этаж",Секция Корпус Б • Сдача корпуса 2 кв. 2027,Соколиная гора,4 минуты пешком,"Москва, ВАО, р-н Соколиная гора, м. Соколиная гора, улица 8-я Соколиной Горы, 26",15 567 700 ₽,379 700 ₽/м²
