Ссылка,Название,Описание,Метро,Дальность от метро,Адрес,Стоимость,Стоимость за метр
https://www.cian.ru/sale/flat/307405817/,Реальное предложение!,"2-комн. апартаменты, 84 м², 32/78 этаж",Информация отсутствует,6 минут пешком,"Москва, ЦАО, р-н Пресненский, м. Москва-Сити, 1-й Красногвардейский проезд, 22с2",46 000 000 ₽,547 619 ₽/м²
https://www.cian.ru/sale/flat/311280933/,Шикарный вид и современный ремонт,"2-комн. квартира, 39 м², 11/12 этаж",Кузьминки,15 минут пешком,"Москва, ЮВАО, р-н Кузьминки, м. Кузьминки, улица Федора Полетаева, 28",11 950 000 ₽,306 410 ₽/м²
https://www.cian.ru/sale/flat/306783471/,"2-комн. квартира, 178,6 м², 3/5 этаж",Секция 1 • Сдан,Смоленская,6 минут пешком,"Москва, ЦАО, р-н Арбат, м. Смоленская, улица Арбат, 39",150 400 000 ₽,842 105 ₽/м²
https://www.cian.ru/sale/flat/306509264/,Срочная продажа,"2-комн. квартира, 69 м², 2/39 этаж",Информация отсутствует,8 минут пешком,"Москва, ЗАО, р-н Раменки, м. Аминьевская, улица Лобачевского, 120к1",48 000 000 ₽,695 652 ₽/м²
https://www.cian.ru/sale/flat/307950039/,Большая кухня! Гардеробная,"2-комн. квартира, 40 м², 6/9 этаж",Сходненская,14 минут пешком,"Москва, СЗАО, р-н Южное Тушино, м. Сходненская, Туристская улица, 4К4",13 990 000 ₽,349 750 ₽/м²
https://www.cian.ru/sale/flat/308399369/,"2-комн. квартира, 75,79 м², 5/11 этаж",Секция 1 • Сдача корпуса 4 кв. 2024,Фили,8 минут пешком,"Москва, ЗАО, р-н Филевский парк, м. Фили, Фили Сити ЖК",56 842 500 ₽,750 000 ₽/м²
https://www.cian.ru/sale/flat/306652887/,Идеально под аренду,"2-комн. апартаменты, 92 м², 9/68 этаж",Информация отсутствует,4 минуты пешком,"Москва, ЦАО, р-н Пресненский, м. Москва-Сити, 1-й Красногвардейский проезд, 22с1",105 000 000 ₽,1 141 304 ₽/м²
https://www.cian.ru/sale/flat/311097872/,"2-комн. квартира, 47,4 м², 9/9 этаж",Информация отсутствует,Отрадное,13 минут пешком,"Москва, СВАО, р-н Отрадное, м. Отрадное, улица Бестужевых, 3А",15 990 000 ₽,337 342 ₽/м²
https://www.cian.ru/sale/flat/310752969/,"2-комн. квартира, 76,2 м², 13/50 этаж",Секция 1 • Сдача корпуса 2 кв. 2027,Информация отсутствует,11 минут пешком,"Москва, ЗАО, р-н Раменки, м. Мичуринский проспект, Кинематографический кв-л",34 594 800 ₽,454 000 ₽/м²
https://www.cian.ru/sale/flat/310641949/,Новый дизайнерский ремонт,"2-комн. квартира, 58,4 м², 12/23 этаж",Терехово ,5 минут на транспорте,"Москва, СЗАО, р-н Хорошево-Мневники, м. Терехово , улица Нижние Мневники, 16к1",37 200 000 ₽,636 986 ₽/м²
https://www.cian.ru/sale/flat/310831723/,"2-комн. квартира, 40 м², 14/14 этаж",Информация отсутствует,Информация отсутствует,3 минуты пешком,"Москва, СВАО, р-н Марьина роща, м. Марьина Роща, проезд 4-й Марьиной рощи, 10",17 650 000 ₽,441 250 ₽/м²
https://www.cian.ru/sale/flat/308070879/,"2-комн. квартира, 58,1 м², 13/24 этаж",Секция 1 • Сдан,Технопарк,5 минут пешком,"Москва, ЮАО, р-н Нагатинский затон, м. Технопарк, проспект Андропова, 9/1к2",29 152 640 ₽,501 767 ₽/м²
https://www.cian.ru/sale/flat/305738210/,С видами на Москву-реку,"2-комн. апартаменты, 71,8 м², 18/79 этаж",Информация отсутствует,4 минуты пешком,"Москва, ЦАО, р-н Пресненский, м. Москва-Сити, 1-й Красногвардейский проезд, 22с2",49 500 000 ₽,689 415 ₽/м²
https://www.cian.ru/sale/flat/310970361/,Светлая квартира с гардеробной,"2-комн. квартира, 44 м², 9/9 этаж",Ясенево,11 минут пешком,"Москва, ЮЗАО, р-н Ясенево, м. Ясенево, Голубинская улица, 25К2",14 300 000 ₽,325 000 ₽/м²
https://www.cian.ru/sale/flat/302722354/,"2-комн. апартаменты, 46,8 м², 2/16 этаж",Секция 1 • Сдача корпуса 2 кв. 2025,Тульская,6 минут пешком,"Москва, ЮАО, р-н Даниловский, м. Тульская, улица Серпуховский Вал",24 943 792 ₽,532 987 ₽/м²
https://www.cian.ru/sale/flat/299655879/,Неповторимые закаты!,"2-комн. квартира, 46 м², 14/24 этаж",Матвеевская,18 минут пешком,"Москва, ЗАО, р-н Очаково-Матвеевское, м. Матвеевская, Нежинская улица, 5к2",31 000 000 ₽,673 913 ₽/м²
https://www.cian.ru/sale/flat/304387535/,2-х кв 54м2. Прописка Москва,"2-комн. квартира, 53,88 м², 6/17 этаж",Филатов Луг,15 минут на транспорте,"Москва, НАО (Новомосковский), м. Филатов Луг, № 176 кв-л, Квартал Марьино ЖК, к2",9 400 000 ₽,174 462 ₽/м²
https://www.cian.ru/sale/flat/304841949/,Квартира премиум-класса в ЗАО,"2-комн. квартира, 62,2 м², 3/34 этаж • Секция Башня 2",Парк Победы,17 минут пешком,"Москва, ЗАО, р-н Раменки, м. Парк Победы, проезд 4-й Сетуньский, 10Ас2",40 243 400 ₽,647 000 ₽/м²
https://www.cian.ru/sale/flat/311183118/,продает собственник,"2-комн. квартира, 74,3 м², 15/20 этаж",Информация отсутствует,15 минут пешком,"Москва, ЗАО, р-н Раменки, м. Аминьевская, улица Василия Ланового, 3",34 000 000 ₽,457 604 ₽/м²
https://www.cian.ru/sale/flat/307325426/,Большая лоджия 10м.,"2-комн. квартира, 42 м², 5/9 этаж",Сходненская,12 минут пешком,"Москва, СЗАО, р-н Южное Тушино, м. Сходненская, Туристская улица, 6К3",14 000 000 ₽,333 333 ₽/м²
https://www.cian.ru/sale/flat/301551567/,"2-комн. квартира, 59,1 м², 13/34 этаж",Секция 1 • Сдача корпуса 1 кв. 2028,Беломорская,16 минут пешком,"Москва, САО, р-н Левобережный, м. Беломорская, Ленинградское шоссе",25 111 590 ₽,424 900 ₽/м²
https://www.cian.ru/sale/flat/310774802/,"2-комн. квартира, 53,4 м², 28/29 этаж",Информация отсутствует,Серпуховская,11 минут пешком,"Москва, ЦАО, р-н Якиманка, м. Серпуховская, Мытная улица, 40к1",42 800 000 ₽,801 498 ₽/м²
https://www.cian.ru/sale/flat/302074602/,Семейная двушка с дизайн-ремонтом,"2-комн. квартира, 39 м², 7/14 этаж",Юго-Восточная,7 минут пешком,"Москва, ЮВАО, р-н Выхино-Жулебино, м. Юго-Восточная, Ташкентская улица, 4К1",12 999 999 ₽,333 333 ₽/м²
https://www.cian.ru/sale/flat/308968775/,"2-комн. квартира, 88 м², 3/9 этаж",Секция 4 • Сдача корпуса 4 кв. 2026,Спортивная,12 минут пешком,"Москва, ЦАО, р-н Хамовники, м. Спортивная, 531-й кв-л, Дом 22 ЖК",146 748 800 ₽,1 667 600 ₽/м²
https://www.cian.ru/sale/flat/309676186/,Квартира с характером,"2-комн. апартаменты, 61,2 м², 24/79 этаж",Информация отсутствует,4 минуты пешком,"Москва, ЦАО, р-н Пресненский, м. Москва-Сити, 1-й Красногвардейский проезд, 22с2",58 000 000 ₽,947 712 ₽/м²
https://www.cian.ru/sale/flat/311189183/,Отличное состояние!,"2-комн. квартира, 60,3 м², 13/17 этаж",Рассказовка,10 минут пешком,"Москва, НАО (Новомосковский), м. Рассказовка, Внуковское поселение, улица Бориса Пастернака, 21",19 200 000 ₽,318 408 ₽/м²
https://www.cian.ru/sale/flat/310686576/,"2-комн. квартира, 158,4 м², 4/5 этаж",Сдан,Полянка,6 минут пешком,"Москва, ЦАО, р-н Якиманка, м. Полянка, Старомонетный переулок, 19/11С1",586 080 000 ₽,3 700 000 ₽/м²
https://www.cian.ru/sale/flat/309200944/,Привлекательная цена!,"2-комн. квартира, 66 м², 5/13 этаж",Парк Победы,11 минут пешком,"Москва, ЗАО, р-н Дорогомилово, м. Поклонная, улица Братьев Фонченко",75 000 000 ₽,1 136 364 ₽/м²
https://www.cian.ru/sale/flat/308406721/,Квартира мечты в центре Москвы,"2-комн. квартира, 61 м², 7/24 этаж",Красные ворота,2 минуты пешком,"Москва, ЦАО, р-н Красносельский, м. Красные ворота, Садовая-Спасская улица, 21/1",48 000 000 ₽,786 885 ₽/м²
https://www.cian.ru/sale/flat/308399369/,"2-комн. квартира, 75,79 м², 5/11 этаж",Секция 1 • Сдача корпуса 4 кв. 2024,Фили,8 минут пешком,"Москва, ЗАО, р-н Филевский парк, м. Фили, Фили Сити ЖК",56 842 500 ₽,750 000 ₽/м²
https://www.cian.ru/sale/flat/310269057/,Видовая квартира с террасой,"2-комн. квартира, 116 м², 2/21 этаж",Улица 1905 года,7 минут пешком,"Москва, ЦАО, р-н Пресненский, м. Улица 1905 года, улица Костикова, 4к3",135 000 000 ₽,1 163 793 ₽/м²
https://www.cian.ru/sale/flat/307776076/,Светлая квартира с мебелью!,"2-комн. квартира, 40 м², 9/9 этаж",Кантемировская,9 минут пешком,"Москва, ЮАО, р-н Царицыно, м. Кантемировская, улица Бехтерева, 11К1",13 800 000 ₽,345 000 ₽/м²
https://www.cian.ru/sale/flat/311238249/,"2-комн. квартира, 51,6 м², 2/9 этаж",Секция 4 • Сдача корпуса 1 кв. 2025,Рассказовка,5 минут на транспорте,"Москва, НАО (Новомосковский), м. Рассказовка, Переделкино Ближнее мкр, 17-й кв-л, к4",13 480 149 ₽,261 243 ₽/м²
https://www.cian.ru/sale/flat/306821480/,"2-комн. апартаменты, 45,8 м², 3/7 этаж",Информация отсутствует,Улица 1905 года,13 минут пешком,"Москва, ЦАО, р-н Пресненский, м. Улица 1905 года, Большой Тишинский переулок, 38",41 600 000 ₽,908 297 ₽/м²
https://www.cian.ru/sale/flat/310608335/,Видовая квартира,"2-комн. квартира, 60 м², 9/11 этаж",Парк Победы,1 минута пешком,"Москва, ЗАО, р-н Дорогомилово, м. Парк Победы, улица Генерала Ермолова, 4",37 000 000 ₽,616 667 ₽/м²
https://www.cian.ru/sale/flat/293713880/,"2-комн. квартира, 85,6 м², 2/14 этаж",Секция 1 • Сдача корпуса 4 кв. 2024,Боровицкая,20 минут пешком,"Москва, ЦАО, р-н Якиманка, м. Новокузнецкая, Лаврушинский ЖК",184 760 000 ₽,2 158 411 ₽/м²
https://www.cian.ru/sale/flat/311319916/,Лучший Новогодний подарок!!!,"2-комн. квартира, 71 м², 11/18 этаж",Филатов Луг,10 минут на транспорте,"Москва, НАО (Новомосковский), м. Филатов Луг, Московский г., улица Никитина, 11к4",18 500 000 ₽,260 563 ₽/м²
https://www.cian.ru/sale/flat/310571157/,Квартира с видом на набережную!,"2-комн. квартира, 90 м², 3/5 этаж",Воробьёвы горы,14 минут пешком,"Москва, ЮЗАО, р-н Гагаринский, м. Воробьёвы горы, Андреевская набережная, 1",78 000 000 ₽,866 667 ₽/м²
https://www.cian.ru/sale/flat/307668269/,Резиденция с авторской отделкой,"2-комн. квартира, 61,6 м², 6/25 этаж",Кунцевская,9 минут пешком,"Москва, ЗАО, р-н Фили-Давыдково, м. Кунцевская, Малая Филевская улица, 46",48 664 000 ₽,790 000 ₽/м²
https://www.cian.ru/sale/flat/309123191/,Центр. Рядом с Эрмитажем.,"2-комн. квартира, 70 м², 4/11 этаж",Маяковская,11 минут пешком,"Москва, ЦАО, р-н Тверской, м. Маяковская, улица Каретный Ряд, 5/10С2",39 750 000 ₽,567 857 ₽/м²
https://www.cian.ru/sale/flat/309576664/,Дизайнерская двушка с ремонтом!,"2-комн. квартира, 42,4 м², 3/8 этаж",Аэропорт,8 минут пешком,"Москва, САО, р-н Аэропорт, м. Аэропорт, улица Черняховского, 12",21 800 000 ₽,514 151 ₽/м²
https://www.cian.ru/sale/flat/306305918/,"2-комн. квартира, 64,67 м², 12/33 этаж",Секция 2 • Сдача корпуса 4 кв. 2027,Информация отсутствует,8 минут пешком,"Москва, ЦАО, р-н Пресненский, м. Белорусская, улица Пресненский Вал, 27С6",34 114 071 ₽,527 510 ₽/м²
https://www.cian.ru/sale/flat/311036856/,"2-комн. квартира, 72,8 м², 28/41 этаж",Информация отсутствует,Петровский Парк,15 минут пешком,"Москва, САО, р-н Хорошевский, м. Аэропорт, Ленинградский проспект, 37/6",73 000 000 ₽,1 002 747 ₽/м²
https://www.cian.ru/sale/flat/308657571/,Квартира на Кутузовском проспекте,"2-комн. квартира, 43,7 м², 2/5 этаж",Славянский бульвар,15 минут пешком,"Москва, ЗАО, р-н Фили-Давыдково, м. Кунцевская, Кутузовский проспект, 69К2",16 000 000 ₽,366 133 ₽/м²
https://www.cian.ru/sale/flat/301259912/,"2-комн. квартира, 42,5 м², 14/42 этаж",Секция 1 • Сдан,Нагорная,20 минут пешком,"Москва, ЮЗАО, р-н Котловка, м. Нагорная, Севастопольский проспект, 22А",23 012 773 ₽,541 477 ₽/м²
https://www.cian.ru/sale/flat/310966103/,Функциональная планировка! Виды!,"2-комн. квартира, 71 м², 12/21 этаж",Улица 1905 года,7 минут пешком,"Москва, ЦАО, р-н Пресненский, м. Улица 1905 года, улица Костикова, 4к3",82 000 000 ₽,1 154 930 ₽/м²
https://www.cian.ru/sale/flat/310256120/,"2-комн. квартира, 44,1 м², 2/9 этаж",Информация отсутствует,Ольховая,20 минут на транспорте,"Москва, ТАО (Троицкий), м. Троицк, Троицк, В мкр, 30",7 800 000 ₽,176 871 ₽/м²
https://www.cian.ru/sale/flat/309403148/,"2-комн. квартира, 41 м², 3/17 этаж",Секция Корпус Б • Сдача корпуса 2 кв. 2027,Соколиная гора,4 минуты пешком,"Москва, ВАО, р-н Соколиная гора, м. Соколиная гора, улица 8-я Соколиной Горы, 26",15 567 700 ₽,379 700 ₽/м²
https://www.cian.ru/sale/flat/311341337/,Новый дизайнерский ремонт,"2-комн. квартира, 67,5 м², 20/21 этаж",Динамо,5 минут пешком,"Москва, САО, р-н Беговой, м. Динамо, Ленинградский проспект, 29к2",58 000 000 ₽,859 259 ₽/м²
https://www.cian.ru/sale/flat/310282867/,Новая видовая двушка,"2-комн. квартира, 38 м², 29/33 этаж",Информация отсутствует,8 минут пешком,"Москва, ЮВАО, р-н Нижегородский, м. Нижегородская, Газгольдерная улица, 10",17 500 000 ₽,460 526 ₽/м²
https://www.cian.ru/sale/flat/310752969/,"2-комн. квартира, 76,2 м², 13/50 этаж",Секция 1 • Сдача корпуса 2 кв. 2027,Информация отсутствует,11 минут пешком,"Москва, ЗАО, р-н Раменки, м. Мичуринский проспект, Кинематографический кв-л",34 594 800 ₽,454 000 ₽/м²
https://www.cian.ru/sale/flat/302074228/,Премиальная отделка! Виды на Сити,"2-комн. квартира, 144 м², 14/20 этаж",Улица 1905 года,12 минут пешком,"Москва, ЦАО, р-н Пресненский, м. Улица 1905 года, улица Сергея Макеева, 9к1",150 000 000 ₽,1 041 667 ₽/м²
https://www.cian.ru/sale/flat/310181345/,"2-комн. квартира, 50,6 м², 11/12 этаж",Информация отсутствует,Марьина Роща,8 минут пешком,"Москва, СВАО, р-н Марьина роща, м. Марьина Роща, Октябрьская улица, 33",18 500 000 ₽,365 613 ₽/м²
https://www.cian.ru/sale/flat/306733065/,"2-комн. квартира, 58,18 м², 2/28 этаж",Секция 1 • Сдача корпуса 2 кв. 2025,Нагатинская,4 минуты пешком,"Москва, ЮАО, р-н Нагатино-Садовники, м. Нагатинская, Нагатинская улица, к1вл1",27 400 186 ₽,470 955 ₽/м²
https://www.cian.ru/sale/flat/305921142/,Коллегам 60%,"2-комн. квартира, 72,8 м², 28/41 этаж",Аэропорт,12 минут пешком,"Москва, САО, р-н Хорошевский, м. Аэропорт, Ленинградский проспект, 37/6",73 000 000 ₽,1 002 747 ₽/м²
https://www.cian.ru/sale/flat/310798925/,Квартира с дизайнерским ремонтом!,"2-комн. квартира, 40 м², 6/9 этаж",Щёлковская,12 минут пешком,"Москва, ВАО, р-н Гольяново, м. Щёлковская, Байкальская улица, 15",14 200 000 ₽,355 000 ₽/м²
https://www.cian.ru/sale/flat/310580355/,"2-комн. квартира, 62,7 м², 24/32 этаж",Сдан,Калужская,18 минут пешком,"Москва, ЮЗАО, р-н Черемушки, м. Калужская, Херсонская улица, 43к5",38 486 514 ₽,613 820 ₽/м²
https://www.cian.ru/sale/flat/309818292/,Доступна рассрочка без %,"2-комн. апартаменты, 63,8 м², 11/11 этаж",Информация отсутствует,6 минут пешком,"Москва, САО, р-н Савеловский, м. Савёловская, улица Нижняя Масловка, 10Б",35 728 000 ₽,560 000 ₽/м²
https://www.cian.ru/sale/flat/310412625/,Квартира с большой лоджией,"2-комн. квартира, 62,6 м², 15/16 этаж",Комсомольская,10 минут пешком,"Москва, ЦАО, р-н Красносельский, м. Площадь трёх вокзалов, Большая Спасская улица, 10К1",26 000 000 ₽,415 335 ₽/м²
https://www.cian.ru/sale/flat/306067906/,"2-комн. квартира, 40,53 м², 2/57 этаж",Сдача корпуса 3 кв. 2025,Фили,5 минут пешком,"Москва, ЗАО, р-н Филевский парк, м. Фили, Фили Сити ЖК",26 210 751 ₽,646 700 ₽/м²
https://www.cian.ru/sale/flat/310310642/,Панорамные окна! Вид на парк!,"2-комн. квартира, 64,75 м², 6/10 этаж",Парк Победы,12 минут пешком,"Москва, ЗАО, р-н Дорогомилово, м. Поклонная, Виктори Парк Резиденсез ЖК, 3к7",70 000 000 ₽,1 081 081 ₽/м²
https://www.cian.ru/sale/flat/302550491/,"2-комн. квартира, 56,1 м², 23/26 этаж",Информация отсутствует,Профсоюзная,11 минут пешком,"Москва, ЮЗАО, р-н Ломоносовский, м. Профсоюзная, улица Архитектора Власова, 2",23 999 000 ₽,427 790 ₽/м²
https://www.cian.ru/sale/flat/308017401/,"2-комн. апартаменты, 71,8 м², 8/17 этаж",Сдача корпуса 4 кв. 2024,Парк Победы,4 минуты на транспорте,"Москва, ЗАО, р-н Филевский парк, м. Филёвский парк, улица Василисы Кожиной, вл25/1",46 626 920 ₽,649 400 ₽/м²
https://www.cian.ru/sale/flat/297469215/,Лучшая цена за кв.м.,"2-комн. апартаменты, 64,2 м², 8/9 этаж",Маяковская,2 минуты пешком,"Москва, ЦАО, р-н Тверской, м. Маяковская, 1-я Тверская-Ямская улица, 2",75 990 000 ₽,1 183 645 ₽/м²
https://www.cian.ru/sale/flat/308985158/,"Сауна,Купель,Терраса,2уровня,h=4м","2-комн. апартаменты, 66 м², 1/2 этаж",Соколиная гора,9 минут пешком,"Москва, ВАО, р-н Соколиная гора, м. Соколиная гора, 2-й Вольный переулок, 11",13 999 999 ₽,212 121 ₽/м²
https://www.cian.ru/sale/flat/297413640/,"2-комн. апартаменты, 69,2 м², 11/14 этаж",Секция 2 • Сдан,Тёплый Стан,10 минут пешком,"Москва, ЮЗАО, р-н Ясенево, м. Тёплый Стан, Новоясеневский проспект, 3В",20 490 120 ₽,296 100 ₽/м²
https://www.cian.ru/sale/flat/309326808/,Новый дизайнерский ремонт,"2-комн. квартира, 73,4 м², 8/11 этаж",Информация отсутствует,3 минуты пешком,"Москва, ЦАО, р-н Тверской, м. Белорусская, Лесная улица, 4с1",70 000 000 ₽,953 678 ₽/м²
https://www.cian.ru/sale/flat/311410978/,Лучшая цена в районе!,"2-комн. квартира, 43,3 м², 5/5 этаж",Сокол,15 минут пешком,"Москва, САО, р-н Аэропорт, м. Красный Балтиец, 3-й Балтийский переулок, 4К2",11 500 000 ₽,265 589 ₽/м²
https://www.cian.ru/sale/flat/304841949/,Квартира премиум-класса в ЗАО,"2-комн. квартира, 62,2 м², 3/34 этаж • Секция Башня 2",Парк Победы,17 минут пешком,"Москва, ЗАО, р-н Раменки, м. Парк Победы, проезд 4-й Сетуньский, 10Ас2",40 243 400 ₽,647 000 ₽/м²
https://www.cian.ru/sale/flat/308418795/,"2-комн. квартира, 54,4 м², 11/43 этаж",Информация отсутствует,Кутузовская,18 минут пешком,"Москва, ЗАО, р-н Раменки, м. Кутузовская, 1-й Сетуньский проезд, 8",30 990 000 ₽,569 669 ₽/м²
https://www.cian.ru/sale/flat/307089602/,"2-комн. квартира, 79,1 м², 31/40 этаж",Информация отсутствует,Информация отсутствует,2 минуты пешком,"Москва, САО, р-н Ховрино, м. Ховрино, улица Дыбенко, 38к1",30 500 000 ₽,385 588 ₽/м²
